{
    "project_id":  "2025-0001-case-17",
    "case_id":  "2025-0001",
    "site":  {
                 "ambient_c":  30,
                 "voltage_class":  "LV",
                 "country":  "KR"
             },
    "loads":  [
                  {
                      "phase":  "A",
                      "width_unit":  0.45,
                      "id":  "L17A",
                      "heat_w":  432,
                      "kva":  18.8
                  },
                  {
                      "width_unit":  0.45,
                      "id":  "L17B",
                      "heat_w":  424,
                      "kva":  18.95
                  },
                  {
                      "width_unit":  0.45,
                      "id":  "L17C",
                      "heat_w":  430,
                      "kva":  16.1
                  }
              ],
    "enclosure":  {
                      "required_d":  375,
                      "required_w":  660,
                      "required_h":  1780
                  },
    "ip_min":  "IP54",
    "requested_totals":  {
                             "granularity":  "summary",
                             "currency":  "KRW"
                         },
    "document":  {
                     "date":  "2025-09-19",
                     "project_number":  "KIS-2025-17",
                     "project_name":  "Project-17",
                     "client":  "Client-17"
                 },
    "brand":  {
                  "logo_ref":  "assets/logo.svg",
                  "primary_color":  "003366",
                  "font_size":  11
              }
}
